{
  "version": 1,
  "positions": {
    "alto": {
      "x": 36.017444794369624,
      "y": -163.38995492047766,
      "source": ","
    },
    "elna": {
      "x": -34.83538088121683,
      "y": 134.13184916227746,
      "source": ","
    },
    "kai": {
      "x": 170.82064032372477,
      "y": 118.00832879843414,
      "source": ","
    },
    "lina": {
      "x": 310.0839683404744,
      "y": -170.1139930332326,
      "source": ","
    },
    "mira": {
      "x": -244.53315550150074,
      "y": -102.09419819418059,
      "source": ","
    },
    "noah": {
      "x": -248.38091057101855,
      "y": 132.0136691811225,
      "source": ","
    }
  },
  "layout": "auto",
  "configLayout": "auto",
  "camera": {
    "x": 447.8121560652171,
    "y": 366.7110532224526,
    "scale": 1.1081409956219876,
    "width": 958,
    "height": 677
  },
  "ui": {
    "details": true,
    "focus": false
  }
}
